Id,Author(s),Organisation,Organisation type,Title,Abstract,Description,Date,Type,Publication specifications,Platform sector,Platform name,Platform work typology,Country,Keywords,Language,Methodology,Availability,Link URL,Link Label
tmp-14,"Altman, E.J.; Tuschman, M.L.",Harvard Business School,Research institute,"Platforms, open/user innovation, and ecosystems: A strategic leadership perspective","Platform, open/user innovation, and ecosystem strategies embrace and enable interactions with external entities. Firms pursuing these approaches conduct business and interact with environments differently than those pursuing traditional closed strategies. This paper considers these strategies together highlighting similarities and differences between platform, open/user innovation, and ecosystem strategies. We focus on managerial and organizational challenges for organizations pursuing these strategies and identify four institutional logic shifts associated with these strategic transitions: 1) increasing external focus, 2) moving to greater openness, 3) focusing on enabling interactions, and 4) adopting interaction-centric metrics. As mature incumbent organizations adopt these strategies, there may be tensions and multiple conflicting institutional logics. Additionally, we consider four strategic leadership topics and how they relate to platform, open/user innovation, and ecosystem strategies: 1) executive orientation and experience, 2) top management teams, 3) board-management relations, and 4) executive compensation. We discuss theoretical implications, and consider future directions and research opportunities.",,2017-01-01,Research publication,"Altman, E.J. and Tuschman, M.L. (2017), 'Platforms, open/user innovation, and ecosystems: A strategic leadership perspective', Advances in strategic management 37, Working paper 17-076, Harvard Business School.  ",professional services; transport; accommodation ,Threadless; IdeaStorm; Uber; Airbnb,On-location platform-determined routine work; Online contestant specialist work ,Other,work organisation; client characteristics,English,Qualitative,Subscription,http://dx.doi.org/10.2139/ssrn.2915213,
tmp-15,"Amar, N; Viossat, L.",Inspection Générale des Affaires Sociales,Government,"Les platformes collaboratives, l'emploi et la protection sociale","The report, released by the Office of the Inspector General for Social Affairs in France (IGAS), presents the first attempt in France to describe and analyze in detail the various social challenges related to collaborative platforms such as Uber, Airbnb and Leboncoin: labour, employment, vocational training, social security, health insurance, unemployment insurance. It includes recommendations which, if implemented, would foster the development of the sharing economy in France and better labour conditions and social protection of collaborative workers. The report is based on a review of academic literature in France and abroad as well as interviews with around 20 platforms operating in France and dozens of collaborative workers, domestic and international experts (OECD, ILO, EC), social partners and domestic government agencies and offices. The report describes the new, complex and rapidly growing ecosystem of collaborative platforms in France, with a total market estimated at €7 billion by the authors. It focuses on "" laborplatforms"" and ""collaborative platform workers"", which include: sharing platforms (Blablacar), organized services platforms (Uber), jobbing platforms (SuperMano), digital cooperatives (LaRuchequiditoui), marketplaces (Priceminister), freelance platforms (Hopwork) and crowdworking platforms (Foule Factory).",,2016-01-01,Research publication,"Amar, N. and Viossat, L.-C. (2016), Les platformes collaboratives, l’emploi et la protection
sociale, Rapport, Inspection Générale des Affaires Sociales, Paris, France",professional services; household tasks; transport,BlaBlacar; Uber; SuperMano; HopWork/Malt; FouleFactory,On-location platform-determined routine work; On-location client determined moderately skilled work; On-location client-determined higher-skilled work; On-location platform-determined higher-skilled work; Online moderately skilled click work,France,employment status; social protection ; taxation; challenges; skills and skills development,French,,Open access,http://www.igas.gouv.fr/spip.php?article551,
tmp-16,"Andreassen, A.",University of Oslo,Research institute,Human rights challenges posed by the fourth industrial revolution - The Uber case (Thesis),"The thesis analyses the way in which the fourth industrial revolution is affecting the right to work, rights at work and the right to social protection and the capacity of states to protect, respect and fulfil those rights. It offers a discussion of the gig economy from a human rights perspective focused on rights at work and an applied case-law analysis on the misclassification of drivers by Uber Technologies Inc.; with an appendix of Uber case-law. The paper takes Uber as a case study and analyses the benefits and challenges of their business model, expanding on the challenges posed by the classification of drivers as independent contractors. The case study analyses the national and international legislation relevant for employment contract law, with a special focus on social and economic rights. [tkrf]",,2017-01-01,Research publication; Case study-platform,"Andreassen, A. (2017), 'Human rights challenges posed by the fourth industrial revolution - The Uber case,' Thesis for the Faculty of Law: University of Oslo, Norway.",transport,Uber,On-location platform-determined routine work,Norway; United States; EU28 ,employment status; legal issues; social protection ,English,Qualitative,Open access,https://www.duo.uio.no/bitstream/handle/10852/60877/7001--HUMR5200.pdf?sequence=1,
tmp-17,"Animento, S.; Di Cesare, G.; Sica, C.",PROKLA: Zeitschrift für kritische Sozialwissenschaften,Publisher,Total eclipse of work? Neue Protestformen in der gig economy am Beispiel des Foodora Streiks in Turin,"Contemporary capitalism is characterized by the expansion of the digital economy, in which new forms of exploitation and of value creation are taking place. In particular, in the gig economy cheap labour is organized and managed via digital platforms. While new forms of protest are also spreading, there is a lack of research on the ways workers of this sector are organizing in order to face hyper-exploitation and precarity. We analyse the case of the Foodora workers in Turin, who have been organizing protests and a strike in the past months. While Italian unions are slow in facing the challenges brought by the transformation of work since the end of Fordism, these and other precarious workers have been developing innovative forms of protests, including a new form of strike, which is much more autonomous than the Fordist one. We highlight some aspects of the Foodora protest, in particular the re-appropriation of public space and the misuse of the means of production, which are turned into weapons against the employer. Finally, we look closer at the property of algorithms as a key issue for future struggles in the digital economy.",,2018-01-01,Research publication,"Animento, S., Di Cesare, G. and Sica, C. (2018), 'Total eclipse of work? Neue Protestformen in der gig economy am Beispiel des Foodora Streiks in Turin,' PROKLA: Zeitschrift für kritische Sozialwissenschaften 187(June). ",transport,Foodora,On-location platform-determined routine work,Italy,"representation, industrial relations, social dialogue; industrial action",German,Qualitative,Subscription,http://prokla.de.w018207c.kasserver.com/index.php/PROKLA/article/view/145,
tmp-18,"Arthurs, H. ",Oxford University Press: Oxford,Research institute,Labour law after labour,"Considerable evidence points to the diminished significance of 'labour' as an industrial and political movement, as a sociological descriptor, and as a distinct field of public policy. This prompts the question: what should labour law be for 'after labour'? The question is especially timely in the context of what Daniel Rogers has called 'the intellectual economy of catastrophe'. This Chapter explores three possible responses: that labour law should be viewed as a sub-field of constitutional and human rights law; that it should integrate workers into the structures of capitalism to ensure that they contribute to and benefit from its successes; and that it should maintain its historic function of mobilizing workers to defend their rights and interests, but should also encourage cooperation between workers' organizations and other social movements.",,2011-01-01,Research publication,"Arthurs, H. (2011), 'Labour law after labour', in Langille, B., and Davidov, G. (eds), The idea of labour law, Oxford University Press: Oxford. ",no specific sector focus,,,Other,challenges; legal issues; employment status,English,Qualitative,Subscription,http://dx.doi.org/10.1093/acprof:oso/9780199693610.003.0002,
tmp-19,"Audun, J.; Roslan, I.; Boyd, C.",Decision Support Systems,Publisher,A survey of trust and reputation systems for online service provision,"Trust and reputation systems represent a significant trend in decision support for Internet mediated service provision. The basic idea is to let parties rate each other, for example after the completion of a transaction, and use the aggregated ratings about a given party to derive a trust or reputation score, which can assist other parties in deciding whether or not to transact with that party in the future. A natural side effect is that it also provides an incentive for good behaviour, and therefore tends to have a positive effect on market quality. Reputation systems can be called collaborative sanctioning systems to reflect their collaborative nature, and are related to collaborative filtering systems. Reputation systems are already being used in successful commercial online applications. There is also a rapidly growing literature around trust and reputation systems, but unfortunately this activity is not very coherent. The purpose of this article is to give an overview of existing and proposed systems that can be used to derive measures of trust and reputation for Internet transactions, to analyse the current trends and developments in this area, and to propose a research agenda for trust and reputation systems.",,2007-01-01,Research publication,"Audun, J., Roslan, I., Boyd, C. (2007), 'A survey of trust and reputation systems for online service provision,' Decision Support Systems 43(2), pp. 618-644. ",no specific sector focus,,,Other,rating; information asymmetry,English,Qualitative,Subscription,http://doi.org/10.1016/j.dss.2005.05.019,
tmp-20,DG IPOL,European Parliament,Government,The social protection of workers in the platform economy; The social protection of workers in the platform economy: Annex; ,"This study investigates the social protection of workers in the platform economy at the request of the European Parliament’s Employment and Social Affairs Committee. The report reviews literature and previous research on the platform economy with the aims of defining it and developing a typology for understanding its nature. It discusses the growth and drivers of the platform economy, as well as benefits and challenges for workers, reporting findings from 50 interviews conducted with expert stakeholders in eight European countries and from an original survey of 1,200 platform workers. It dissects the different normative layers that need to be considered when looking at the challenges of social protection of platform workers from a legal perspective. Finally, the report draws conclusions and makes recommendations concerning arrangements for the provision of social protection for workers in this growing sector of the economy.",Two linked reports,2017-01-01,Research publication; Case study-worker,"DG IPOL (2017), The social protection of workers in the platform economy, European Commission, Brussels, Belgium; DG IPOL (2017), The social protection of workers in the platform economy: ANNEX, European Commission, Brussels, Belgium.",professional services,Amazon Mechanical Turk; Microworkers; Clickworker; CrowdFlower,Online moderately skilled click work,Other,employment status; social protection; income; worker demographics,English,Qualitative; Quantitative,Open access,http://www.europarl.europa.eu/thinktank/en/document.html?reference=IPOL_STU(2017)614184,2 documents in 1 record
